[
  {
    "id": "2112252507762368684",
    "date": "2026-10-19",
    "added": "2026-10-20",
    "added_by": "Scout",
    "status": "confirmed",
    "area": "app",
    "title": "Grok Bot on the iPhone Action Button",
    "summary": "You can set Grok Bot as your iPhone's Action Button and press it to talk with your Bot.",
    "source": "https://x.com/bot/status/2112252507762368684"
  },
  {
    "id": "changelog-0-71-2",
    "date": "2026-10-14",
    "added": "2026-10-20",
    "added_by": "Scout",
    "status": "confirmed",
    "area": "app",
    "title": "Bigger attachments, desktop notifications, and more plugin skills",
    "summary": "Version 0.71.2 lets you attach files up to 250 MB and videos up to 1 GB, and up to 20 attachments per message. Replies notify you on your Mac or PC while you use it, Bots can use up to 200 plugin skills instead of 24, and team admins can turn off messaging between Bots.",
    "source": "https://x.ai/changelog/bot"
  },
  {
    "id": "2111184270819803351",
    "date": "2026-10-16",
    "added": "2026-10-17",
    "added_by": "Scout",
    "status": "confirmed",
    "area": "app",
    "title": "Redesigned chat cards",
    "summary": "Cards in Grok Bot chats have a new design with a cleaner layout, part of an update the team says improves quality, polish, and speed.",
    "source": "https://x.com/bot/status/2111184270819803351"
  },
  {
    "id": "2111184272933748980",
    "date": "2026-10-16",
    "added": "2026-10-17",
    "added_by": "Scout",
    "status": "confirmed",
    "area": "app",
    "title": "Refreshed look with a new typeface and themes",
    "summary": "Grok Bot has a refreshed look, with a new typeface and themes.",
    "source": "https://x.com/bot/status/2111184272933748980"
  },
  {
    "id": "2111184275374813362",
    "date": "2026-10-16",
    "added": "2026-10-17",
    "added_by": "Scout",
    "status": "confirmed",
    "area": "app",
    "title": "Grok Bot is much faster",
    "summary": "The Grok Bot team says computer tasks now finish 3x sooner on average, and replies to everything else arrive in less than half the time.",
    "source": "https://x.com/bot/status/2111184275374813362"
  },
  {
    "id": "2111184276662481202",
    "date": "2026-10-16",
    "added": "2026-10-17",
    "added_by": "Scout",
    "status": "confirmed",
    "area": "voice",
    "title": "Faster, more reliable voice calls",
    "summary": "Voice calls with Grok Bot are faster, more reliable, and better at remembering past conversations.",
    "source": "https://x.com/bot/status/2111184276662481202"
  },
  {
    "id": "2111184279938240959",
    "date": "2026-10-16",
    "added": "2026-10-17",
    "added_by": "Scout",
    "status": "confirmed",
    "area": "x",
    "title": "Tag @bot on X to start a task",
    "summary": "Tag @bot in a post on X and Grok Bot gets to work on it.",
    "source": "https://x.com/bot/status/2111184279938240959"
  },
  {
    "id": "2111184281636909233",
    "date": "2026-10-16",
    "added": "2026-10-17",
    "added_by": "Scout",
    "status": "confirmed",
    "area": "app",
    "title": "Notifications only on the device you're using",
    "summary": "Grok Bot notifications now go only to the device you're using.",
    "source": "https://x.com/bot/status/2111184281636909233"
  },
  {
    "id": "2111184282903523440",
    "date": "2026-10-16",
    "added": "2026-10-17",
    "added_by": "Scout",
    "status": "confirmed",
    "area": "x",
    "title": "Grok Bot can read X Chat",
    "summary": "Grok Bot can now read X Chat. Connect X, then ask it to work across your messages.",
    "source": "https://x.com/bot/status/2111184282903523440"
  },
  {
    "id": "2111184284786802881",
    "date": "2026-10-16",
    "added": "2026-10-17",
    "added_by": "Scout",
    "status": "confirmed",
    "area": "connectors",
    "title": "Robinhood, Coinbase, Trello, and more connectors",
    "summary": "Grok Bot now connects to Robinhood, Coinbase, Trello, PostHog, beehiiv, eToro, and more. Teams can also now submit connectors to the Grok Bot marketplace.",
    "source": "https://x.com/bot/status/2111184284786802881"
  },
  {
    "id": "2110840796954202186",
    "date": "2026-10-15",
    "added": "2026-10-15",
    "added_by": "Scout",
    "status": "confirmed",
    "area": "connectors",
    "title": "Plugins can be submitted",
    "summary": "A Grok Bot team member shared that anyone can submit plugins for Grok Bot (and Grok and Cursor) through a public submission form.",
    "source": "https://x.com/poteto/status/2110840796954202186"
  },
  {
    "id": "2110496237241667621",
    "date": "2026-10-14",
    "added": "2026-10-15",
    "added_by": "Scout",
    "status": "confirmed",
    "area": "email",
    "title": "Plus aliases for Grok Bot email",
    "summary": "Grok Bot email supports plus aliases: send and receive with dedicated aliases, or set routines that trigger only for mail sent to one alias.",
    "source": "https://x.com/i/status/2110496237241667621",
    "corrected": "2026-10-17: confirmed by the official @bot account (https://x.com/bot/status/2111184278377857410), so the status changed from reported to confirmed."
  },
  {
    "id": "2110469724660441365",
    "date": "2026-10-14",
    "added": "2026-10-15",
    "added_by": "Scout",
    "status": "reported",
    "area": "connectors",
    "title": "Basecamp connector launched",
    "summary": "Basecamp announced an official Grok Bot connector, available from Connect Apps inside Grok Bot.",
    "source": "https://x.com/i/status/2110469724660441365"
  },
  {
    "id": "2110029484758028732",
    "date": "2026-10-13",
    "added": "2026-10-15",
    "added_by": "Scout",
    "status": "confirmed",
    "area": "community",
    "title": "Grok Bot X Communities",
    "summary": "The team opened applications for curated Grok Bot group chats on X for GTM, product, marketing, engineering, recruiting, and design.",
    "source": "https://x.com/poteto/status/2110029484758028732"
  },
  {
    "id": "2110009541760839701",
    "date": "2026-10-13",
    "added": "2026-10-15",
    "added_by": "Scout",
    "status": "confirmed",
    "area": "app",
    "title": "Weekly roundup video",
    "summary": "A team video walks through the week: Bot's own email, better X, Shopify, more color, email drafts, Bot's computer, template search, PR previews, routine right-clicks, and 5 new languages.",
    "source": "https://x.com/mattyp/status/2110009541760839701"
  },
  {
    "id": "2109784144649838754",
    "date": "2026-10-12",
    "added": "2026-10-15",
    "added_by": "Scout",
    "status": "confirmed",
    "area": "billing",
    "title": "One plan for Grok, Grok Bot, Cursor, and X",
    "short_title": "One plan for Grok, Grok Bot, Cursor, X",
    "summary": "The X Subscription is one plan covering Cursor, Grok, Grok Bot, and X Premium. Every change is opt-in; if you do nothing, nothing changes.",
    "source": "https://x.com/mattyp/status/2109784144649838754"
  },
  {
    "id": "2108609764766908772",
    "date": "2026-10-09",
    "added": "2026-10-15",
    "added_by": "Scout",
    "status": "confirmed",
    "area": "email",
    "title": "Grok Bot gets its own email",
    "summary": "Bots can use their own email address to sign up for services, contact businesses for you, or schedule time with someone.",
    "source": "https://x.com/bot/status/2108609764766908772"
  },
  {
    "id": "2108228871938359347",
    "date": "2026-10-08",
    "added": "2026-10-15",
    "added_by": "Scout",
    "status": "confirmed",
    "area": "connectors",
    "title": "Shopify connector",
    "summary": "Connect Shopify, then ask Grok Bot to check orders, track inventory, and keep product listings up to date.",
    "source": "https://x.com/bot/status/2108228871938359347"
  },
  {
    "id": "2107949161878606089",
    "date": "2026-10-07",
    "added": "2026-10-15",
    "added_by": "Scout",
    "status": "confirmed",
    "area": "x",
    "title": "Search, read, and monitor X",
    "summary": "Grok Bot can now search, read, and monitor X.",
    "source": "https://x.com/bot/status/2107949161878606089"
  },
  {
    "id": "2106083136002310193",
    "date": "2026-10-02",
    "added": "2026-10-15",
    "added_by": "Scout",
    "status": "confirmed",
    "area": "billing",
    "title": "Usage limits reset",
    "summary": "Usage limits were reset for all Grok Bot users.",
    "source": "https://x.com/bot/status/2106083136002310193"
  },
  {
    "id": "2105713240701538538",
    "date": "2026-10-01",
    "added": "2026-10-15",
    "added_by": "Scout",
    "status": "confirmed",
    "area": "app",
    "title": "Proactive suggestions",
    "summary": "Grok Bot can now suggest ways to help without you needing to ask.",
    "source": "https://x.com/bot/status/2105713240701538538"
  },
  {
    "id": "2105373767568621895",
    "date": "2026-09-30",
    "added": "2026-10-15",
    "added_by": "Scout",
    "status": "confirmed",
    "area": "coding",
    "title": "Better for building software",
    "summary": "Bots can hand off coding tasks to Cursor, manage PRs with the GitHub and Origin plugins, and share video demos of what they build.",
    "source": "https://x.com/bot/status/2105373767568621895"
  },
  {
    "id": "2103936247995752705",
    "date": "2026-09-26",
    "added": "2026-10-15",
    "added_by": "Scout",
    "status": "confirmed",
    "area": "connectors",
    "title": "Finance integration",
    "summary": "Link bank, card, and investment accounts with the new Finance integration, then ask Grok Bot to help manage spending and investments.",
    "source": "https://x.com/bot/status/2103936247995752705"
  },
  {
    "id": "2102532697960956074",
    "date": "2026-09-22",
    "added": "2026-10-15",
    "added_by": "Scout",
    "status": "confirmed",
    "area": "app",
    "title": "Cleaner interface",
    "summary": "Quality-of-life update with a cleaner interface for working with your bots.",
    "source": "https://x.com/bot/status/2102532697960956074"
  },
  {